MLR_No,ML_Lic_No,Period,Name_Eng,Name_Chi,Expiry_Date,Remarks
4774,0889/2019,As at 29 February 2020,Midland Credit Limited,美聯信貸有限公司,23-May-20,
4771,0888/2019,As at 29 February 2020,Jet Rich Finance Limited,富泰財務有限公司,23-May-20,
4143,0887/2019,As at 29 February 2020,Chinawide International Finance Limited,中匯國際財務有限公司,02-Jul-20,
3585,0886/2019,As at 29 February 2020,Goldbay Finance Limited,金立財務有限公司,08-Aug-20,
3578,0885/2019,As at 29 February 2020,Expert International Capital Limited,精英國際資本有限公司,25-Jul-20,
3379,0884/2019,As at 29 February 2020,Orient First Capital Limited,建銀財務(香港)有限公司,31-Jul-20,
3215,0883/2019,As at 29 February 2020,Winners Finance Limited,易信集團有限公司,17-May-20,
3076,0882/2019,As at 29 February 2020,Trillion Empire Limited,兆皇有限公司,30-Jun-20,
2901,0881/2019,As at 29 February 2020,CCW Finance Limited,諾楠國際財務有限公司,15-May-20,
2748,0880/2019,As at 29 February 2020,Ontone Finance Company Limited,安通財務有限公司,14-May-20,
2378,0879/2019,As at 29 February 2020,Chong Yip Finance Limited,創業財務有限公司,14-Jul-20,
1970,0878/2019,As at 29 February 2020,Daido Home Finance Limited,大同軒財務有限公司,26-Jun-20,
1950,0877/2019,As at 29 February 2020,Genertec Hong Kong International Capital Limited,通用技術集團香港國際資本有限公司,11-Jun-20,
1739,0876/2019,As at 29 February 2020,China Merchants Properties Development Limited,招商局置業有限公司,18-May-20,
1738,0875/2019,As at 29 February 2020,Hong Kong Wahsheung Properties Limited,香港華商置業有限公司,18-May-20,
1452,0874/2019,As at 29 February 2020,Shenwan Hongyuan Finance (H.K.) Limited,申萬宏源財務(香港)有限公司,27-Jul-20,
1340,0872/2019,As at 29 February 2020,Peace Town Finance Limited,平和財務有限公司,05-May-20,
5504,0871/2019,As at 29 February 2020,"Anglo Chinese Project Finance, Limited",,08-Aug-20,
5502,0870/2019,As at 29 February 2020,Ascento Vision Limited,,08-Aug-20,
5490,0869/2019,As at 29 February 2020,"WT Finease Research Centre Co., Limited",偉泰易借研究中心有限公司,08-Aug-20,
5150,0868/2019,As at 29 February 2020,China Prosperity (Hong Kong) Limited,中民集團有限公司,19-Jul-20,
5059,0867/2019,As at 29 February 2020,Keystone Finance Limited,翹石財務有限公司,24-Apr-20,
4877,0866/2019,As at 29 February 2020,Leading Win Credit Limited,領達信貸有限公司,08-Aug-20,
4762,0865/2019,As at 29 February 2020,Top Winton Limited,港運通有限公司,02-May-20,
4531,0864/2019,As at 29 February 2020,Markway Finance Limited,萬威財務有限公司,21-Jul-20,
3760,0863/2019,As at 29 February 2020,Asia Prosperity Limited,亞洲財富有限公司,08-May-20,R
3687,0862/2019,As at 29 February 2020,Million Promise Limited,萬諾有限公司,04-Jun-20,
3569,0861/2019,As at 29 February 2020,Full Baba Finance Company Limited,富爸爸財務有限公司,16-Jul-20,
3543,0860/2019,As at 29 February 2020,Win Wind Resources Limited,萬贏資源有限公司,30-May-20,
3538,0859/2019,As at 29 February 2020,Zhongrong PT Finance Limited,中融平和財務有限公司,30-May-20,
3536,0858/2019,As at 29 February 2020,Ever Nice International Industrial Limited,恒麗國際實業有限公司,16-May-20,
3530,0857/2019,As at 29 February 2020,Seabury TFX (H K) Limited,,09-May-20,
3361,0856/2019,As at 29 February 2020,Professional Credit Consultants Company Limited,專業信貸顧問有限公司,19-Jun-20,
3336,0855/2019,As at 29 February 2020,Upright Finance Limited,正利財務有限公司,03-May-20,
3058,0854/2019,As at 29 February 2020,Fu Tat Credit Limited,富達信貸有限公司,02-Jul-20,
2357,0853/2019,As at 29 February 2020,Sang Sang Finance & Investments Limited,生生財務投資有限公司,11-Jun-20,
2346,0852/2019,As at 29 February 2020,Business Finance (Asia) Limited,東信財務(亞洲)有限公司,28-Apr-20,R
2645,0851/2019,As at 29 February 2020,Honip Credit Limited,康業信貸有限公司,03-Jul-20,
5503,0850/2019,As at 29 February 2020,DES Finance Company Limited,焯然財務有限公司,01-Aug-20,
5501,0849/2019,As at 29 February 2020,Goodway Finance Limited,668財務有限公司,01-Aug-20,
5498,0848/2019,As at 29 February 2020,Kings Treasure Credit Limited,國富財務有限公司,01-Aug-20,
5146,0847/2019,As at 29 February 2020,PT Finance Limited ,保德財務有限公司,19-Jul-20,
5108,0846/2019,As at 29 February 2020,Credit Hero Limited,英雄信貸有限公司,19-Jun-20,
5065,0845/2019,As at 29 February 2020,Profit Joy Credit Company Limited,盈悅信貸有限公司,03-May-20,
4962,0844/2019,As at 29 February 2020,E Capital Limited,億資本有限公司,03-May-20,
4500,0843/2019,As at 29 February 2020,Fortune Global Capital Advisor Limited,富豐國際資本顧問有限公司,21-Jun-20,
4094,0842/2019,As at 29 February 2020,Worthy Sky International Limited,敬天國際有限公司,26-May-20,
4076,0841/2019,As at 29 February 2020,Celebrity Credit Limited,名人信貸有限公司,07-May-20,
3371,0840/2019,As at 29 February 2020,Hong Yang Credit Limited,宏揚信貸有限公司,19-Jun-20,
3367,0839/2019,As at 29 February 2020,Apex Ally Limited,,26-Jun-20,
3349,0838/2019,As at 29 February 2020,Gold Dynasty International Finance Limited,金朝國際金融有限公司,29-May-20,
3005,0837/2019,As at 29 February 2020,National Industrial and Commercial Credit Limited,國民工商信貸有限公司,22-May-20,
2336,0836/2019,As at 29 February 2020,Bestlite Industrial Limited,佰輝實業有限公司,05-May-20,
1985,0835/2019,As at 29 February 2020,Panoramia (Investments) Limited,亮景(投資)有限公司,13-Jun-20,
1768,0834/2019,As at 29 February 2020,"The Pacific Insurance Company, Limited",太平洋保險有限公司,29-Jun-20,
1765,0833/2019,As at 29 February 2020,Ying's International Finance Limited,英士國際財務有限公司,22-Jun-20,
1741,0832/2019,As at 29 February 2020,Business Finance Limited,東隆物業按揭有限公司,18-May-20,
1431,0831/2019,As at 29 February 2020,Lai Sun Finance Limited,麗新財務有限公司,09-Jun-20,
1314,0830/2019,As at 29 February 2020,"Anglo Chinese Securities, Limited",英高證券有限公司,21-Jun-20,
310,0829/2019,As at 29 February 2020,Itochu Hong Kong Limited,伊藤忠商事(香港)有限公司,16-May-20,
5093,0828/2019,As at 29 February 2020,Juk Coeng International Holding Company Limited ,昱瑲國際控股有限公司,31-May-20,
4105,0827/2019,As at 29 February 2020,KP Credit Gain Finance Company Limited,港佳領達財務有限公司,26-May-20,
2632,0826/2019,As at 29 February 2020,Oi Wah Pawnshop Credit Limited,靄華押業信貸有限公司,17-May-20,
5496,0825/2019,As at 29 February 2020,Treasure Gain Credit Limited,創盈信貸有限公司,30-Jul-20,
5494,0824/2019,As at 29 February 2020,Profitable Credit Limited,銀滙信貸有限公司,30-Jul-20,
5493,0823/2019,As at 29 February 2020,Comeloan Credit Service Limited,金隆財務信貸有限公司,30-Jul-20,
5488,0822/2019,As at 29 February 2020,Bona Fide Capital Financing Limited,真誠財資有限公司,30-Jul-20,
5125,0821/2019,As at 29 February 2020,Delightful Aesthetics Investment Limited,愉悅醫美投資有限公司,05-Jul-20,
5075,0820/2019,As at 29 February 2020,Luxe Mortgage Limited,豪門世家信貸有限公司,03-May-20,
5071,0819/2019,As at 29 February 2020,Goodwill Professional Consultant Limited,,03-May-20,
4759,0818/2019,As at 29 February 2020,L K Finance Consultants Limited,利基財務顧問有限公司,02-May-20,
4755,0817/2019,As at 29 February 2020,Gold Water Bay Capital Limited,金水灣創富有限公司,27-Apr-20,
3779,0816/2019,As at 29 February 2020,Gain Yield Limited,宏通中港有限公司,22-May-20,
3369,0815/2019,As at 29 February 2020,Silver City International (HK) Limited,銀城國際(香港)有限公司,19-Jun-20,
3357,0814/2019,As at 29 February 2020,Hao Tian Finance Company Limited,昊天財務有限公司,19-Jun-20,
3143,0813/2019,As at 29 February 2020,The Pacific Finance and Investment Limited,太平洋財務投資有限公司,29-Jun-20,
2492,0812/2019,As at 29 February 2020,Standard Land Finance Limited,均地財務有限公司,20-May-20,
5069,0811/2019,As at 29 February 2020,High Surplus International Limited,盈高國際有限公司,03-May-20,
5507,0809/2019,As at 29 February 2020,Wisdom Wealth Finance Limited,富譽信貸有限公司,25-Jul-20,
5497,0808/2019,As at 29 February 2020,Jet Finance Limited,速達財務有限公司,25-Jul-20,
5495,0807/2019,As at 29 February 2020,MP Credit Limited,多角度信貸有限公司,25-Jul-20,
5074,0806/2019,As at 29 February 2020,Sunshine Property Mortgage Limited,陽光物業信貸有限公司,03-May-20,
5068,0805/2019,As at 29 February 2020,U Credit Limited,美源信貸有限公司,03-May-20,
4499,0804/2019,As at 29 February 2020,Kin Fat Credit Finance Limited,建發信貸財務有限公司,21-Jun-20,
4480,0803/2019,As at 29 February 2020,Morning Dew Finance Limited,甘露財務有限公司,26-Apr-20,
4474,0802/2019,As at 29 February 2020,Prime Investments (HK) Limited,八方投資(香港)有限公司,26-Apr-20,
4116,0801/2019,As at 29 February 2020,3 Sing Credit Limited,三昇信貸有限公司,04-Jun-20,
4074,0800/2019,As at 29 February 2020,Park Credit Limited,百業信貸有限公司,28-Apr-20,
4053,0799/2019,As at 29 February 2020,Kong Way Credit Company Limited,港匯信貸有限公司,18-Jun-20,
4052,0798/2019,As at 29 February 2020,Transmate Development Limited,環美發展有限公司,02-Jun-20,
3764,0797/2019,As at 29 February 2020,Rong Investment and Finance Limited,融財務有限公司,08-May-20,
3563,0796/2019,As at 29 February 2020,VIP Mortgage Limited,貴賓樓按有限公司,25-Jun-20,
3513,0795/2019,As at 29 February 2020,Global Hill Asia Finance Co. Limited,鼎峰亞洲財務有限公司,23-May-20,
3364,0794/2019,As at 29 February 2020,Cashbox Credit Services Limited,錢鉅財務有限公司,12-Jun-20,
3322,0793/2019,As at 29 February 2020,E Finance Limited,易財務有限公司,17-Jul-20,
2692,0792/2019,As at 29 February 2020,Kwok Chung Motors Limited,國松車行有限公司,19-Jun-20,
2352,0791/2019,As at 29 February 2020,EAA Credit Limited,,16-Jul-20,
1944,0790/2019,As at 29 February 2020,Phillip Finance (HK) Limited,輝立財務(香港)有限公司,21-May-20,
1881,0789/2019,As at 29 February 2020,Jinhui Finance (Hong Kong) Limited,金輝財務(香港)有限公司,07-Jul-20,
1563,0788/2019,As at 29 February 2020,Ryoden Property Finance Limited,菱電物業財務有限公司,23-Jun-20,
1143,0787/2019,As at 29 February 2020,China Agricultural Finance Company Limited,農銀財務有限公司,11-May-20,
802,0786/2019,As at 29 February 2020,Malahon Securities Limited,萬利豐證券有限公司,24-May-20,
5492,0785/2019,As at 29 February 2020,Wifilend Limited,快貸有限公司,23-Jul-20,
5489,0784/2019,As at 29 February 2020,Wealth Reach Finance Limited,盈進財務有限公司,23-Jul-20,
5486,0783/2019,As at 29 February 2020,T-Money Finance Limited ,信匯信貸有限公司,23-Jul-20,
5484,0782/2019,As at 29 February 2020,Greatest One Limited,巨捷有限公司,23-Jul-20,
5482,0781/2019,As at 29 February 2020,Chaintimes Finance Limited,,06-Aug-20,
5481,0780/2019,As at 29 February 2020,Ever Estate Credit Limited ,永業信貸有限公司,06-Aug-20,
5469,0779/2019,As at 29 February 2020,The Core Finance Company Limited,核聚財務有限公司,23-Jul-20,
5398,0778/2019,As at 29 February 2020,BC Group Asia Limited,,23-Jul-20,
5050,0777/2019,As at 29 February 2020,Venturist Capital Limited,創基資本有限公司,12-Apr-20,
4764,0776/2019,As at 29 February 2020,Tectum Consultancy Limited,,02-May-20,
4752,0775/2019,As at 29 February 2020,Huisheng Enterprise (Hong Kong) Limited,惠生實業(香港)有限公司,25-Apr-20,
4489,0774/2019,As at 29 February 2020,"Eastern Evergain Investment & Trading Co., Limited",東方能得利國貿有限公司,26-May-20,
3337,0773/2019,As at 29 February 2020,Sky Credit Limited,樂天按揭信貸有限公司,24-Apr-20,
2945,0772/2019,As at 29 February 2020,China Sun Finance Company Limited,中森財務有限公司,26-Jul-20,
1421,0771/2019,As at 29 February 2020,Winson Credit Company Limited,宏信信貸有限公司,13-May-20,
5487,0770/2019,As at 29 February 2020,Easy Take Money Finance Limited,易借財務有限公司,18-Jul-20,
5091,0769/2019,As at 29 February 2020,BOTW Lending and Assets Management Limited ,橋水信貸資本有限公司,31-May-20,
5061,0768/2019,As at 29 February 2020,Hoover Finance Limited,豪華財務有限公司,24-Apr-20,
4810,0767/2019,As at 29 February 2020,UA Finance Limited,,06-Jul-20,
4785,0766/2019,As at 29 February 2020,Good Finance Limited ,好財務有限公司,08-Jun-20,
4760,0765/2019,As at 29 February 2020,Taihe Finance Limited,泰合金融有限公司,02-May-20,
4475,0764/2019,As at 29 February 2020,Union Bloom Consultants Limited,聯億顧問有限公司,05-May-20,
4113,0763/2019,As at 29 February 2020,"La Sasa Credit Service Co., Limited",來按易信貸服務有限公司,04-Jun-20,
4061,0762/2019,As at 29 February 2020,Great Wall Mortgage Company Limited,長城按揭有限公司,21-Apr-20,
3815,0761/2019,As at 29 February 2020,Great Fortune (International) Finance Company Limited,八方位(國際)財務有限公司,15-Jul-20,
3533,0760/2019,As at 29 February 2020,China System Finance Limited,華信財務有限公司,16-May-20,
3358,0759/2019,As at 29 February 2020,Megabond Finance Limited,萬嘉寶財務有限公司,05-Jun-20,
3214,0758/2019,As at 29 February 2020,Trilane Management Consultant Limited,駿凌商業顧問有限公司,26-Apr-20,
3006,0757/2019,As at 29 February 2020,Winland Mortgage Limited,永倫按揭有限公司,24-Jun-20,
2842,0756/2019,As at 29 February 2020,China Capital Limited,中滙按揭信貸有限公司,14-Jun-20,
2634,0755/2019,As at 29 February 2020,Rich Ocean Asia Finance Limited,富洋亞洲財務有限公司,02-May-20,
2487,0754/2019,As at 29 February 2020,South China Financial Credits Limited,南華信貸財務有限公司,20-May-20,
2182,0753/2019,As at 29 February 2020,Kingsway SW Finance Limited,滙富財務有限公司,24-Jun-20,
1014,0752/2019,As at 29 February 2020,Onshine Finance Limited,朗盈信貸有限公司,06-Jun-20,
3,0751/2019,As at 29 February 2020,Superyield Finance Limited,兆億財務有限公司,05-Jul-20,
5105,0750/2019,As at 29 February 2020,Cash Square Limited,錢坊有限公司,14-Jun-20,
5079,0749/2019,As at 29 February 2020,GOGO Lending Limited,高高信貸有限公司,08-May-20,
4748,0748/2019,As at 29 February 2020,Century (HK) Holdings Company Limited,世紀(香港)控股有限公司,06-Apr-20,
4690,0747/2019,As at 29 February 2020,Mega Prosperity (Hong Kong) Finance Limited,景盛(香港)財務有限公司,20-Apr-20,
4683,0746/2019,As at 29 February 2020,DA Finance (HK) Limited,德林財務(香港)有限公司,16-May-20,
4490,0745/2019,As at 29 February 2020,Henter Finance Limited,衡泰財務有限公司,26-May-20,
4137,0744/2019,As at 29 February 2020,Easy Star Credit Limited,易達信貸有限公司,02-Jul-20,
4109,0743/2019,As at 29 February 2020,MG Finance Limited,萬達信貸財務有限公司,02-Jun-20,
4102,0742/2019,As at 29 February 2020,Longtop Enterprises Limited,長泰企業有限公司,21-May-20,
4087,0741/2019,As at 29 February 2020,Wealth Investment Holding (Group) Limited,滙富投資控股(集團)有限公司,12-May-20,
4057,0740/2019,As at 29 February 2020,SN Finance Limited,盛諾財務有限公司,21-Apr-20,
3609,0739/2019,As at 29 February 2020,Rich Top Finance Limited,達成財務有限公司,14-Jun-20,
3440,0737/2019,As at 29 February 2020,Golden Phoenix Finance Limited,金鳳凰融資財務有限公司,30-May-20,
3292,0736/2019,As at 29 February 2020,BSG Finance Limited,寶誠財務有限公司,02-Jun-20,
3283,0735/2019,As at 29 February 2020,City China International Limited,城中國際有限公司,19-Apr-20,
3212,0734/2019,As at 29 February 2020,Sino Credit Limited,中浩物業信貸有限公司,28-Jun-20,
3209,0733/2019,As at 29 February 2020,Kirin Finance Limited,麒麟財務有限公司,14-Apr-20,
3134,0732/2019,As at 29 February 2020,GoPro Financier Company Limited,高普財務有限公司,20-Apr-20,
2840,0731/2019,As at 29 February 2020,Cosmos Tech Limited,利信達有限公司,21-Jun-20,
2681,0730/2019,As at 29 February 2020,First Horizon Limited,第一海域有限公司,25-Apr-20,R
1746,0729/2019,As at 29 February 2020,Harvest Rank Development Limited trading as Po Lee Pawnshop,達宏發展有限公司經營寶利押,07-Jun-20,
49,0728/2019,As at 29 February 2020,AsiaSec Finance Limited,亞證財務有限公司,13-May-20,
36,0727/2019,As at 29 February 2020,Verder Finance Company Limited,維大財務有限公司,30-May-20,
2831,0726/2019,As at 29 February 2020,Sun Finance Company Limited,太陽國際財務有限公司,26-Apr-20,
5483,0725/2019,As at 29 February 2020,Sunpro Investments Limited,,11-Jul-20,
5480,0724/2019,As at 29 February 2020,United Capital Planning Limited,聯合資本策劃有限公司,11-Jul-20,
5479,0723/2019,As at 29 February 2020,Central Link Credit Limited ,中正財號信貸有限公司,11-Jul-20,
5478,0722/2019,As at 29 February 2020,Affluence Credit Limited,溢豐信貸有限公司,11-Jul-20,
4749,0721/2019,As at 29 February 2020,Hanhua Hongkong Holdings Limited,瀚華香港控股有限公司,11-Jul-20,
3700,0720/2019,As at 29 February 2020,Union Good Finance Limited,聯發財務有限公司,11-Jul-20,
5060,0719/2019,As at 29 February 2020,Quick Credit Limited,,24-Apr-20,R
5055,0718/2019,As at 29 February 2020,YES Finance Limited,,19-Apr-20,
5049,0717/2019,As at 29 February 2020,Kimberland Credit Limited,金百盛信貸有限公司,10-Apr-20,
4805,0716/2019,As at 29 February 2020,i-Choice Limited,匡財有限公司,04-Jul-20,
4778,0715/2019,As at 29 February 2020,Minghing Finance (HK) Limited ,明興財務(香港)有限公司,06-Jun-20,
4754,0714/2019,As at 29 February 2020,CLK Development Company Limited,進利佳發展有限公司,06-Apr-20,
4750,0713/2019,As at 29 February 2020,Rise Capital (Hong Kong) Limited,昇姿企業有限公司,06-Apr-20,
4123,0712/2019,As at 29 February 2020,China Runking Financing Group Limited,中國潤金小貸集團有限公司,16-Jun-20,
3829,0711/2019,As at 29 February 2020,Sino Investment Limited,中浩投資發展有限公司,24-Jul-20,
3788,0710/2019,As at 29 February 2020,China Best Finance Limited,國華財務有限公司,10-Jun-20,
3561,0709/2019,As at 29 February 2020,SME Credit Company Limited,中小企財務有限公司,25-Jun-20,
3372,0708/2019,As at 29 February 2020,Win Gold International Financing Group Limited,永高國際金融集團有限公司,26-Jun-20,
3206,0707/2019,As at 29 February 2020,Kingsway Finance Limited,國滙信貸有限公司,07-Apr-20,
3136,0706/2019,As at 29 February 2020,Ka Bo Finance Limited,家寶財務有限公司,20-Apr-20,
2950,0705/2019,As at 29 February 2020,Manatee Finance Limited,萬宜財務有限公司,21-Jun-20,
2488,0704/2019,As at 29 February 2020,KCK Finance Company Limited,浩鏗信貸理財有限公司,03-Jun-20,
5470,0703/2019,As at 29 February 2020,Solar Scape Finance Limited,陽景財務有限公司,09-Jul-20,
5107,0702/2019,As at 29 February 2020,Grand Plus Services Limited,一本服務有限公司,14-Jun-20,
5088,0701/2019,As at 29 February 2020,Fortunet Development Limited,鑫網發展有限公司,24-May-20,
5057,0700/2019,As at 29 February 2020,Wealth Rise Credit Service Limited,富升信貸有限公司,19-Apr-20,R
5029,0699/2019,As at 29 February 2020,"Natu International Investing Co., Limited",瑞眾國際投資有限公司,29-Mar-20,
4983,0698/2019,As at 29 February 2020,BOA Credit Company Limited,亞銀信用有限公司,08-May-20,
4763,0697/2019,As at 29 February 2020,Global P2P Group Holdings Limited,,02-May-20,
4756,0696/2019,As at 29 February 2020,Zhongcai Finance Limited,中財財務有限公司,27-Apr-20,
4736,0695/2019,As at 29 February 2020,New Century Finance Limited,新世紀財務有限公司,13-Apr-20,
4700,0694/2019,As at 29 February 2020,Kellett Corporate Secretarial Limited,眾安公司秘書有限公司,06-Apr-20,
4465,0693/2019,As at 29 February 2020,M International Capital Limited,雙龍國際資本有限公司,21-Apr-20,
4060,0692/2019,As at 29 February 2020,Zero Finance Hong Kong Limited,零在金融香港有限公司,21-Apr-20,R
3801,0691/2019,As at 29 February 2020,Golden Connection Finance Limited,金匯聯財務有限公司,24-Jun-20,
3667,0690/2019,As at 29 February 2020,Prestige Finance Limited,優越按揭財務有限公司,24-May-20,
2952,0689/2019,As at 29 February 2020,RHB Finance Hong Kong Limited,興業金融財務有限公司,26-Jun-20,
2900,0688/2019,As at 29 February 2020,CW Financing Limited,,30-May-20,
2837,0687/2019,As at 29 February 2020,Sino Pacific Finance Limited,佳石財務有限公司,05-May-20,
2641,0686/2019,As at 29 February 2020,Kaiser Credit Limited,嘉信信貸有限公司,05-Jun-20,
2625,0685/2019,As at 29 February 2020,KGI International Finance Limited,凱基國際金融有限公司,08-May-20,
2575,0684/2019,As at 29 February 2020,Century Legend Finance Limited,世紀建業融資有限公司,15-Jun-20,
2483,0683/2019,As at 29 February 2020,Cashflow Credit Limited,加富信貸有限公司,11-May-20,
1613,0682/2019,As at 29 February 2020,Oriental Patron Securities Limited,東英亞洲證券有限公司,19-May-20,
5477,0681/2019,As at 29 February 2020,Winfield Credit Limited,盈輝信貸有限公司,04-Jul-20,
5473,0680/2019,As at 29 February 2020,Constant Credit Limited,銀信財務有限公司,04-Jul-20,
5468,0679/2019,As at 29 February 2020,Y H Finance Limited ,源興財務有限公司,04-Jul-20,
5467,0678/2019,As at 29 February 2020,Leading 77 Finance Limited ,鉅泰77信貸有限公司,04-Jul-20,
5096,0677/2019,As at 29 February 2020,Sheng Shi Da Strategic Capital Limited,盛世達資本策略有限公司,31-May-20,
5077,0676/2019,As at 29 February 2020,Time's Capital Holdings Limited,時代資本控股有限公司,08-May-20,
5042,0675/2019,As at 29 February 2020,OneDay Finance Limited,壹天財務有限公司,10-Apr-20,
4460,0674/2019,As at 29 February 2020,"China Travel Financial Investment Holdings Co., Limited",香港中旅金融投資控股有限公司,14-Apr-20,
4045,0673/2019,As at 29 February 2020,Evergreen Finance Limited,柏泰財務有限公司,31-Mar-20,
3528,0672/2019,As at 29 February 2020,Kong Sun Finance Limited,江山財務有限公司,16-Apr-20,
3526,0671/2019,As at 29 February 2020,Welend Limited,衛盈智信(香港)有限公司,16-Apr-20,
3487,0670/2019,As at 29 February 2020,Billion Honour (Asia) Limited,億信(亞洲)有限公司,26-Jun-20,
3325,0669/2019,As at 29 February 2020,Luk Fook Securities (HK) Limited,六福證券(香港)有限公司,03-Apr-20,
3320,0668/2019,As at 29 February 2020,Luk Fook Finance (HK) Limited,六福財務(香港)有限公司,03-Apr-20,
3203,0667/2019,As at 29 February 2020,Dragonite Resources Limited,,12-Apr-20,
3201,0666/2019,As at 29 February 2020,Joy Wealth Finance Limited,寶欣財務有限公司,07-Apr-20,
3196,0665/2019,As at 29 February 2020,Goldyard Finance Limited,金營財務有限公司,29-Mar-20,
2751,0664/2019,As at 29 February 2020,Credit Finance Investments Company Limited,信用財務投資有限公司,11-Jun-20,
2326,0663/2019,As at 29 February 2020,Smart Million Limited,俊萬有限公司,01-Apr-20,
2318,0662/2019,As at 29 February 2020,Classic Charter Limited,京卓有限公司,16-Apr-20,R
1550,0661/2019,As at 29 February 2020,Preamble Properties Finance Limited,銀寶物業按揭有限公司,18-May-20,
1349,0660/2019,As at 29 February 2020,ITC Properties Finance Limited,德祥地產財務有限公司,23-Jun-20,
4410,0659/2019,As at 29 February 2020,Easy Credit Finance Limited,易達來財務有限公司,04-Jul-20,
5476,0658/2019,As at 29 February 2020,Credit Intelligence Finance (Hong Kong) Limited,信智財務(香港)有限公司,27-Jun-20,
5475,0657/2019,As at 29 February 2020,TWCW Credit Company Limited ,快易財務有限公司,27-Jun-20,
5471,0656/2019,As at 29 February 2020,M & F (Finance) Company Limited ,日天信貸有限公司,27-Jun-20,
3908,0655/2019,As at 29 February 2020,Differ Financial Holdings Limited,鼎豐金融控股有限公司,27-Jun-20,
5053,0654/2019,As at 29 February 2020,Happy Star Capital Investment Limited,喜星創富有限公司,10-Apr-20,
5043,0653/2019,As at 29 February 2020,Bless Nation Limited,財國有限公司,27-Mar-20,
4742,0652/2019,As at 29 February 2020,Universe Reach Limited,東都有限公司,06-Apr-20,
4739,0651/2019,As at 29 February 2020,First Credit (HK) Limited,第一信用財務(香港)有限公司,28-Mar-20,
4502,0650/2019,As at 29 February 2020,Azazel Credit Limited,愛信信貸有限公司,21-Jun-20,
4338,0649/2019,As at 29 February 2020,China AF Finance Limited,中國農信財務有限公司,29-Mar-20,R
4049,0648/2019,As at 29 February 2020,Orient Securities Finance Limited,東方滙財財務有限公司,09-Apr-20,
4033,0647/2019,As at 29 February 2020,Tung Shing Finance Limited,通盛財務有限公司,26-Mar-20,
3783,0646/2019,As at 29 February 2020,Sound World Limited,昌和有限公司,27-May-20,
3782,0645/2019,As at 29 February 2020,Earnest Asia Company Limited,誠寶亞洲有限公司,22-May-20,
3749,0644/2019,As at 29 February 2020,China Times Finance Limited,中辰財務有限公司,01-Apr-20,
3329,0643/2019,As at 29 February 2020,Well Success Finance Limited,益成財務有限公司,17-Apr-20,
3142,0642/2019,As at 29 February 2020,Vinson Finance Limited,仁信財務有限公司,27-May-20,
3139,0641/2019,As at 29 February 2020,Checkmate Finance Limited,卓銘財務有限公司,20-Apr-20,R
3135,0640/2019,As at 29 February 2020,First Asia Finance Limited,第一亞洲財務有限公司,21-Apr-20,R
2835,0639/2019,As at 29 February 2020,Eton Mortgage Limited,易通按揭有限公司,12-May-20,
