MLR_No,ML_Lic_No,Period,Name_Eng,Name_Chi,Expiry_Date,Remarks
5360,0108/2019,As at 29 February 2020,Dong Hill Credit Limited,東山信貸有限公司,28-Mar-20,R
5351,0107/2019,As at 29 February 2020,Sheng Ye International Supply Chain Finance Limited,盛業國際供應鏈金融有限公司,28-Mar-20,R
5369,0106/2019,As at 29 February 2020,Easy Lend Credit Service Limited,貸易財務有限公司,26-Mar-20,R
5359,0105/2019,As at 29 February 2020,Giant Fortune Global Limited,鉅財環球有限公司,26-Mar-20,
5358,0104/2019,As at 29 February 2020,"King Fast Credit Finance Co., Limited",楗暉信貸有限公司,26-Mar-20,
5356,0103/2019,As at 29 February 2020,Dayspring Credit Limited,,26-Mar-20,R
5355,0102/2019,As at 29 February 2020,Sun Win International Investment Limited,新會投資有限公司,26-Mar-20,
5354,0101/2019,As at 29 February 2020,Dao Sheng International Financial Leasing (Hong Kong) Limited,道生國際融資租賃(香港)有限公司,26-Mar-20,
5353,0100/2019,As at 29 February 2020,Money Choice Company Limited,萬里財有限公司,26-Mar-20,
5352,0099/2019,As at 29 February 2020,ZQ Capital Hong Kong Limited,倍哲資本香港有限公司,26-Mar-20,R
5348,0098/2019,As at 29 February 2020,Green Financial Credit Limited,綠色金融信貸有限公司,26-Mar-20,
5347,0097/2019,As at 29 February 2020,Yun Pa Enterprise Limited,潤八企業有限公司,26-Mar-20,R
5346,0096/2019,As at 29 February 2020,Chun Hong Capital Investment Limited,晉航創富財務有限公司,26-Mar-20,
5343,0095/2019,As at 29 February 2020,"Dangdai International Group Co., Limited",當代國際集團有限公司,26-Mar-20,R
5320,0094/2019,As at 29 February 2020,Mr Right Finance Limited,,26-Mar-20,
4265,0093/2019,As at 29 February 2020,Huajin Finance (International) Limited,華金財務(國際)有限公司,26-Mar-20,R
3685,0092/2019,As at 29 February 2020,Get Win Credit Company Limited,得運信貸有限公司,26-Mar-20,
5349,0091/2019,As at 29 February 2020,Come 2 Lend (HK) Limited,唔該借借(香港)有限公司,21-Mar-20,R
5341,0090/2019,As at 29 February 2020,Kiu Fung Credit Limited,翹鋒信貸有限公司,21-Mar-20,R
5338,0089/2019,As at 29 February 2020,Miss Loyalty Credit Limited ,義氣姐信貸有限公司,21-Mar-20,R
4166,0088/2019,As at 29 February 2020,Lik Sang Finance Limited,力生財務有限公司,21-Mar-20,R
5345,0075/2019,As at 29 February 2020,Landsun International Limited,朗順國際有限公司,19-Mar-20,R
5342,0074/2019,As at 29 February 2020,KME Finance Limited,,19-Mar-20,R
5340,0073/2019,As at 29 February 2020,Grand Bay Technology Investment Limited,灣區科技投資有限公司,19-Mar-20,
5334,0072/2019,As at 29 February 2020,EC Money Limited,快達錢有限公司,19-Mar-20,
5333,0071/2019,As at 29 February 2020,Reach Rich Consultant Limited,,19-Mar-20,
5332,0070/2019,As at 29 February 2020,Kar Chun Investment Company Limited,嘉雋投資有限公司,19-Mar-20,R
5329,0069/2019,As at 29 February 2020,28 Credit Limited,28信貸有限公司,19-Mar-20,R
3633,0068/2019,As at 29 February 2020,Oriental First Finance Limited,,19-Mar-20,R
2762,0067/2019,As at 29 February 2020,Smart Star Limited,駿星有限公司,19-Mar-20,R
5337,0066/2019,As at 29 February 2020,Venture Partners Finance Limited ,柏萊財務有限公司,14-Mar-20,
5335,0065/2019,As at 29 February 2020,Forwin Credit Limited,富榮信貸有限公司,14-Mar-20,R
5328,0064/2019,As at 29 February 2020,Kerwin Holdings Limited,嘉暉集團有限公司,14-Mar-20,
5327,0046/2019,As at 29 February 2020,HMS Finance Limited,時分秒財務有限公司,12-Mar-20,
5326,0045/2019,As at 29 February 2020,Freedom Mortgage Limited ,自由財務按揭有限公司,12-Mar-20,
5325,0044/2019,As at 29 February 2020,ATM Capital Limited ,銀通資本有限公司,12-Mar-20,
5324,0043/2019,As at 29 February 2020,Fintech 365 Limited ,365金融服務有限公司,12-Mar-20,R
5322,0042/2019,As at 29 February 2020,New Age Financing Limited,開元財務有限公司,12-Mar-20,R
4505,0041/2019,As at 29 February 2020,Jary Hoover Finance Limited,嘉瑞豪華財務有限公司,12-Mar-20,R
3867,0040/2019,As at 29 February 2020,Tong Bo Finance Company Limited,通寶財務有限公司,12-Mar-20,R
4588,0038/2019,As at 29 February 2020,Global Group Capital Finance Limited,高寶集團資本財務有限公司,22-Sep-19,R
3257,0035/2019,As at 29 February 2020,Colbert Finance Limited,高佰金融有限公司,18-Oct-19,R
5323,0026/2019,As at 29 February 2020,Yue Long Finance Company Limited,譽朗財務有限公司,07-Mar-20,R
5321,0025/2019,As at 29 February 2020,EC Rich Consultant Limited,,07-Mar-20,R
5319,0024/2019,As at 29 February 2020,Billion King Finance Limited ,億京財務有限公司,07-Mar-20,R
5318,0023/2019,As at 29 February 2020,KDT Finance Limited,錦德財務有限公司,07-Mar-20,R
5317,0022/2019,As at 29 February 2020,Top Trendy Enterprise Limited,潮流企業有限公司,07-Mar-20,R
5210,0021/2019,As at 29 February 2020,Capiverse Limited,,07-Mar-20,
2509,0016/2019,As at 29 February 2020,Nomura International (Hong Kong) Limited,野村國際(香港)有限公司,19-Oct-19,R
1983,0015/2019,As at 29 February 2020,China Merchants International Finance Company Limited,招商局國際財務有限公司,30-Oct-19,R
5314,0012/2019,As at 29 February 2020,Golden Prospect Finance Limited,金興財務有限公司,05-Mar-20,R
5313,0011/2019,As at 29 February 2020,Apexplus Finance Limited,鼎盛財務有限公司,05-Mar-20,R
3249,0010/2019,As at 29 February 2020,Create Profit Enterprises Limited,盈創企業有限公司,05-Mar-20,R
3248,0003/2019,As at 29 February 2020,Cisco Systems Capital Asia Pte. Ltd.,,04-Oct-19,R
3742,0002/2019,As at 29 February 2020,Ko Shing Finance Limited,高勝財務有限公司,10-Nov-19,R
4309,0001/2019,As at 29 February 2020,Field Finance Limited,油田財務有限公司,10-Dec-19,R
1884,3277/2018,As at 29 February 2020,Guotai Junan Finance (Hong Kong) Limited,國泰君安財務(香港)有限公司,25-Jan-20,R
5423,2482/2018,As at 29 February 2020,Dickson Holdings Limited,廸生控股有限公司,12-Apr-20,
5408,2481/2018,As at 29 February 2020,Best Selected Mortgage Limited,百士利按揭有限公司,12-Apr-20,
2884,2480/2018,As at 29 February 2020,Core Pacific-Yamaichi Finance Limited,京華山一財務有限公司,12-Apr-20,R
4985,2478/2018,As at 29 February 2020,Shimen Investment Limited,,13-Feb-20,R
4964,2477/2018,As at 29 February 2020,Foison Finance Limited,浩豐金融有限公司,09-Jan-20,R
4733,2476/2018,As at 29 February 2020,Grand Up Finance Limited,廣昇財務有限公司,23-Mar-20,R
4434,2475/2018,As at 29 February 2020,Multiple Property Mortgage Limited,萬幫物業按揭有限公司,15-Mar-20,R
4411,2474/2018,As at 29 February 2020,Honest Smart Finance Limited,傑誠財務有限公司,25-Feb-20,R
4390,2473/2018,As at 29 February 2020,Global Mastermind Financial Services Limited,環球大通金融服務有限公司,04-Feb-20,R
4374,2472/2018,As at 29 February 2020,Hong Kong Mortgage Services Limited,香港按揭服務有限公司,02-Feb-20,R
4014,2470/2018,As at 29 February 2020,Easyway Finance Limited,易進財務有限公司,26-Feb-20,R
4011,2469/2018,As at 29 February 2020,Ferran Finance Limited,富運財務有限公司,03-Mar-20,R
3938,2468/2018,As at 29 February 2020,Success Fame Corporation Limited,成譽有限公司,22-Mar-20,
3847,2467/2018,As at 29 February 2020,Total Success Investment Limited,泰興投資有限公司,17-Jan-20,R
3839,2466/2018,As at 29 February 2020,Chance Achieve Limited,勝達行有限公司,03-Mar-20,R
3726,2465/2018,As at 29 February 2020,Trillion Wide Credit Finance Limited,億兆信貸財務有限公司,18-Mar-20,R
3499,2464/2018,As at 29 February 2020,Hong Kong International Factoring Limited,香港國際保理有限公司,05-Feb-20,R
3200,2463/2018,As at 29 February 2020,Worldwide Financial Limited,衛恒財務有限公司,07-Apr-20,R
2937,2462/2018,As at 29 February 2020,Loan Easy Finance Limited,樂意財務有限公司,08-Feb-20,R
2890,2461/2018,As at 29 February 2020,Richly Regent Limited,富利行有限公司,23-Feb-20,R
2095,2460/2018,As at 29 February 2020,PAL Finance Limited,亞洲企業財務有限公司,05-Feb-20,R
501,2458/2018,As at 29 February 2020,Tomson Investment Limited,湯臣投資有限公司,07-Mar-20,R
3484,2457/2018,As at 29 February 2020,EasyLend Finance Company Limited,易貸網信貸有限公司,22-Jan-20,R
2617,2456/2018,As at 29 February 2020,Ocean Allied Finance Limited,海德國際財務有限公司,22-Mar-20,R
5402,2455/2018,As at 29 February 2020,Manna Finance Limited,,12-Apr-20,R
5400,2454/2018,As at 29 February 2020,Sun Ho Finance Limited,新豪(財務)有限公司,12-Apr-20,R
4979,2453/2018,As at 29 February 2020,KK Credit Limited,,23-Jan-20,R
4944,2451/2018,As at 29 February 2020,Chun Sing Mortgage Limited,進昇按揭有限公司,06-Mar-20,R
4725,2450/2018,As at 29 February 2020,Hong Kong Fairly Well Capital Limited,香港中實資本有限公司,14-Mar-20,R
4697,2449/2018,As at 29 February 2020,Union Finance Limited,匯和財務有限公司,09-Feb-20,R
4676,2448/2018,As at 29 February 2020,Golden Credit Service Limited,金富信貸有限公司,07-Mar-20,R
4658,2447/2018,As at 29 February 2020,One Credit Finance Limited,首譽財務有限公司,29-Dec-19,R
4450,2446/2018,As at 29 February 2020,Oriental FA Limited,東方融資有限公司,31-Mar-20,R
4340,2445/2018,As at 29 February 2020,YUS International Finance Limited,余氏國際財務有限公司,31-Dec-19,R
4017,2444/2018,As at 29 February 2020,Nic Sang Finance Company Limited,力生金融有限公司,03-Mar-20,R
4012,2443/2018,As at 29 February 2020,Profit Speed Resources Management Limited,利浚資源管理有限公司,26-Feb-20,R
3995,2442/2018,As at 29 February 2020,ICC Financial Limited,尚裕金融有限公司,10-Feb-20,R
3971,2441/2018,As at 29 February 2020,Welab Limited,,20-Jan-20,R
3965,2440/2018,As at 29 February 2020,Well Done (HK) Finance Limited,井淼財務有限公司,08-Jan-20,R
3710,2439/2018,As at 29 February 2020,Woodhill Investments Limited,林山投資有限公司,20-Feb-20,R
3703,2438/2018,As at 29 February 2020,PetroAsian Energy Finance Limited,中亞能源財務有限公司,13-Feb-20,R
3697,2437/2018,As at 29 February 2020,Mason Resources Finance Limited,茂宸資源財務有限公司,06-Feb-20,R
3554,2436/2018,As at 29 February 2020,Hexagon Credit Limited,恒信通信貸有限公司,24-Mar-20,R
3064,2435/2018,As at 29 February 2020,Goodview Finance Limited,裕景財務有限公司,31-Mar-20,R
2122,2434/2018,As at 29 February 2020,Easy Billion Finance Co.,順億財務公司,25-Mar-20,R
1915,2433/2018,As at 29 February 2020,Freeway Finance Company Limited,亨運財務有限公司,25-Mar-20,R
1334,2432/2018,As at 29 February 2020,Goodwill Credit Limited,金滙授信有限公司,26-Mar-20,
1201,2431/2018,As at 29 February 2020,Get Nice Finance Company Limited,結好財務有限公司,16-Mar-20,R
1124,2430/2018,As at 29 February 2020,Oriental Ford Finance Limited,律豐財務有限公司,26-Jan-20,R
4396,2429/2018,As at 29 February 2020,Easy One Finance Limited,易易壹財務有限公司,11-Feb-20,R
5401,2428/2018,As at 29 February 2020,Noricap Finance Company Limited,君裕(香港)財務有限公司,12-Apr-20,
5396,2427/2018,As at 29 February 2020,AA Plus Consultant Limited,,12-Apr-20,R
5395,2426/2018,As at 29 February 2020,King Cash Finance Limited,瑞貸財務有限公司,12-Apr-20,
5036,2425/2018,As at 29 February 2020,Alog Technology Development Company Limited,心怡科技發展有限公司,06-Mar-20,R
5019,2424/2018,As at 29 February 2020,Powerful Credit Limited,信安心財務有限公司,01-Mar-20,R
4993,2423/2018,As at 29 February 2020,Prince Wellington Capital Limited ,太子金融有限公司,15-Feb-20,R
4984,2422/2018,As at 29 February 2020,Mig Finance Limited,,08-Feb-20,R
4966,2421/2018,As at 29 February 2020,SW China Investment Limited ,三和中華投資有限公司,18-Jan-20,R
4954,2419/2018,As at 29 February 2020,IC-F Limited,工商融資有限公司,02-Jan-20,R
4715,2418/2018,As at 29 February 2020,Daywon Finance Limited,日昇財務有限公司,07-Mar-20,
4681,2417/2018,As at 29 February 2020,Qupital Limited,橋彼道有限公司,17-Jan-20,R
4669,2416/2018,As at 29 February 2020,EC Promise Limited,,03-Jan-20,R
4445,2415/2018,As at 29 February 2020,Global International Finance Limited,環球貸款有限公司,15-Mar-20,R
4431,2414/2018,As at 29 February 2020,Poly Investment & Finance Limited,保興創投融資有限公司,15-Mar-20,R
4196,2413/2018,As at 29 February 2020,Golden Wheel Capital Limited,金輪資本有限公司,21-Jan-20,R
3510,2412/2018,As at 29 February 2020,Hyatt Asia Financial Limited,凱悅亞洲財務有限公司,14-Mar-20,R
3502,2411/2018,As at 29 February 2020,AMTD Group Company Limited,尚乘集團有限公司,14-Mar-20,R
3483,2410/2018,As at 29 February 2020,AI Finance Limited,快意財務有限公司,08-Jan-20,R
3299,2409/2018,As at 29 February 2020,Scenery Credit Limited,陞宇信貸有限公司,14-Feb-20,R
3275,2408/2018,As at 29 February 2020,WT Finance Company Limited,宏泰財務有限公司,05-Jan-20,R
2735,2407/2018,As at 29 February 2020,BCA Finance Limited,中亞財務有限公司,11-Mar-20,R
2616,2406/2018,As at 29 February 2020,Glorious Bright Limited,千昇有限公司,08-Feb-20,R
2610,2405/2018,As at 29 February 2020,Asia Orient Management Services Limited,滙漢管理服務有限公司,09-Jan-20,R
2452,2404/2018,As at 29 February 2020,NWS (Finance) Limited,新創建(財務)有限公司,14-Jan-20,R
5393,2403/2018,As at 29 February 2020,Paysmart Capital Limited,,12-Apr-20,
5392,2402/2018,As at 29 February 2020,Presitge Financial Limited,拔萃信貸有限公司,12-Apr-20,R
4603,2401/2018,As at 29 February 2020,Asia Credit Company Limited,亞洲信貸有限公司,12-Apr-20,
4998,2400/2018,As at 29 February 2020,Yellow River Consultants Services Limited,黃河顧問服務有限公司,22-Feb-20,R
4716,2398/2018,As at 29 February 2020,Golden City Finance Limited,金城財務有限公司,07-Mar-20,R
4709,2397/2018,As at 29 February 2020,Mortgage 360 Limited,按揭360有限公司,07-Mar-20,R
4685,2396/2018,As at 29 February 2020,Asia Money Limited,亞太正財信貸有限公司,24-Jan-20,R
4439,2395/2018,As at 29 February 2020,Best Ace Technology Limited,捷美科技發展有限公司,24-Mar-20,R
4352,2394/2018,As at 29 February 2020,CMBC International Holdings Limited,民生商銀國際控股有限公司,07-Jan-20,R
4349,2393/2018,As at 29 February 2020,UMH Global Finance & Investment Limited,灃生環球財務投資有限公司,07-Jan-20,R
4329,2392/2018,As at 29 February 2020,BES Group Limited,昌誠集團有限公司,29-Dec-19,R
4282,2391/2018,As at 29 February 2020,Ample Finance Limited,一豐財務有限公司,14-Jan-20,R
3940,2390/2018,As at 29 February 2020,Winner Trend Investment Limited,達勝投資有限公司,20-Jan-20,R
3916,2389/2018,As at 29 February 2020,Carwick Investment Limited,嘉訊投資有限公司,10-Feb-20,R
3714,2388/2018,As at 29 February 2020,HT Solutions Limited,,20-Feb-20,R
3689,2386/2018,As at 29 February 2020,New Finance Limited,新財務有限公司,14-Jan-20,R
3683,2385/2018,As at 29 February 2020,Shining Global Enterprise Limited,信明環球有限公司,14-Jan-20,R
3669,2384/2018,As at 29 February 2020,Nepal Finance Limited,,12-Dec-19,R
3517,2383/2018,As at 29 February 2020,Ocean Link Finance Limited,海聯財務有限公司,21-Mar-20,R
3501,2382/2018,As at 29 February 2020,Changjiang Finance (HK) Limited,長江財務(香港)有限公司,21-Feb-20,R
2819,2381/2018,As at 29 February 2020,Flying Mortgage Limited,飛亞物業按揭有限公司,29-Dec-19,R
1404,2380/2018,As at 29 February 2020,Sui Chong Finance Limited,瑞昌財務有限公司,16-Feb-20,R
1311,2379/2018,As at 29 February 2020,Public Way Investments Limited,眾惠投資有限公司,07-Jan-20,R
561,2378/2018,As at 29 February 2020,Chow Tai Fook Jewellery Company Limited,周大福珠寶金行有限公司,04-Mar-20,R
3959,2377/2018,As at 29 February 2020,Kasthamandap Finance Limited,,12-Apr-20,
4677,2376/2018,As at 29 February 2020,"Avic Capital International Holding Co., Limited",中航資本國際控股有限公司,17-Jan-20,R
4675,2375/2018,As at 29 February 2020,Innovest Finance Limited,粵創財務有限公司,12-Jan-20,R
4671,2374/2018,As at 29 February 2020,Sky Town Holdings Limited,天邦集團有限公司,03-Jan-20,R
4576,2373/2018,As at 29 February 2020,Kirin King Finance Limited,騏豐財務有限公司,02-Feb-20,R
4418,2372/2018,As at 29 February 2020,Yiu Kwong Credit Limited,耀光信貸有限公司,25-Feb-20,R
4395,2371/2018,As at 29 February 2020,Ever Maxrise Limited,協銀有限公司,21-Dec-19,R
4393,2370/2018,As at 29 February 2020,CCIG Financial Services Limited,城投中國金融服務有限公司,28-Jan-20,R
4392,2369/2018,As at 29 February 2020,Golden Jade Finance Limited,金瑜財務有限公司,16-Feb-20,R
4389,2368/2018,As at 29 February 2020,PMC Company Limited,置業按揭顧問有限公司,28-Jan-20,R
4013,2365/2018,As at 29 February 2020,Rich Glory International Investment Limited,達隆國際投資有限公司,26-Feb-20,R
3988,2364/2018,As at 29 February 2020,Great Harbour Investment Holdings Company Limited,全港投資控股有限公司,05-Feb-20,R
3983,2363/2018,As at 29 February 2020,Triumphant Mortgage Credit Limited,凱信按揭信貸有限公司,29-Jan-20,R
3960,2362/2018,As at 29 February 2020,Lohas Finance Limited,,30-Dec-19,R
3951,2361/2018,As at 29 February 2020,C.I.F. Financial Limited,中新金財務有限公司,18-Dec-19,R
3915,2360/2018,As at 29 February 2020,On Yip Finance Limited,安業信貸有限公司,03-Mar-20,R
3736,2359/2018,As at 29 February 2020,LC Link Investment Limited,一聯投資有限公司,18-Mar-20,R
3308,2358/2018,As at 29 February 2020,Premier Finance Limited,卓越財務有限公司,07-Feb-20,R
3307,2357/2018,As at 29 February 2020,Silverburg Limited,銀堡(亞洲)有限公司,28-Feb-20,R
3187,2356/2018,As at 29 February 2020,Net Pacific Finance Group Limited,利通太平洋財務集團有限公司,23-Dec-19,R
3126,2355/2018,As at 29 February 2020,Vigo Hong Kong Investment Limited,滙高香港投資有限公司,21-Jan-20,R
3057,2354/2018,As at 29 February 2020,First Credit Finance Limited,壹財務有限公司,10-Mar-20,R
1382,2352/2018,As at 29 February 2020,Quest Securities Limited,,17-Dec-19,R
5405,2351/2018,As at 29 February 2020,Chinese Gold & Silver Exchange Finance Limited,金銀業貿易場融資有限公司,12-Apr-20,
5397,2350/2018,As at 29 February 2020,Man Chong Finance Planning Limited,文創融資策劃有限公司,12-Apr-20,
4433,2349/2018,As at 29 February 2020,Pasha credit Limited ,珀御信貸有限公司,12-Apr-20,
5026,2348/2018,As at 29 February 2020,Winning Global Fortune Strategy Limited,盈匯全球融資策略有限公司,13-Mar-20,
5013,2347/2018,As at 29 February 2020,HK Union Credit Limited,港聯信貸有限公司,13-Mar-20,
4988,2346/2018,As at 29 February 2020,China Huarong Macau (HK) Investment Holdings Limited,中國華融澳門(香港)投資控股有限公司,08-Feb-20,R
4978,2345/2018,As at 29 February 2020,UY Scuti Finance Limited ,浩瀚融資有限公司,23-Jan-20,R
4973,2344/2018,As at 29 February 2020,Rich Smart Finance Limited,富駿財務有限公司,30-Jan-20,R
4952,2343/2018,As at 29 February 2020,"COFCO Capital (Hong Kong) Co., Limited",中糧資本(香港)有限公司,28-Dec-19,R
4666,2341/2018,As at 29 February 2020,Double Treasure International Limited,二寶國際有限公司,22-Dec-19,R
4661,2340/2018,As at 29 February 2020,Lerado Finance Limited,隆成財務有限公司,29-Dec-19,R
4659,2339/2018,As at 29 February 2020,Armstrong Asia Finance Limited,智庫亞洲財務有限公司,20-Dec-19,R
4429,2338/2018,As at 29 February 2020,Crown Glory Holdings Limited,冠能集團有限公司,10-Mar-20,R
4414,2337/2018,As at 29 February 2020,Tian Yuan Financial Leasing And Credit Limited,天元金融租賃信貸有限公司,25-Feb-20,R
4379,2336/2018,As at 29 February 2020,Leading 1356 Company Limited,利泰1356有限公司,28-Jan-20,R
4376,2335/2018,As at 29 February 2020,Uda Holdings Limited,宇田控股有限公司,04-Feb-20,R
3989,2333/2018,As at 29 February 2020,"Yes Choice Universal Investment Co., Limited",標準環球投資有限公司,05-Feb-20,R
3701,2332/2018,As at 29 February 2020,Shun On Finance Limited,順安財務有限公司,13-Feb-20,R
3276,2330/2018,As at 29 February 2020,Finet Finance Limited,財華財務有限公司,05-Jan-20,R
2992,2329/2018,As at 29 February 2020,Paul Y. Finance Limited,保華財務有限公司,15-Jan-20,R
2775,2328/2018,As at 29 February 2020,Pan Asian Mortgage Company Limited,宏亞按揭證券有限公司,27-Jan-20,R
2072,2327/2018,As at 29 February 2020,Cityline Finance Limited,城利財務有限公司,19-Dec-19,R
1198,2326/2018,As at 29 February 2020,Sumitomo Mitsui Finance and Leasing (Hong Kong) Limited,三井住友融資租賃(香港)有限公司,19-Feb-20,R
570,2325/2018,As at 29 February 2020,Wah Sun Finance Limited,華新財務有限公司,04-Mar-20,R
4361,2324/2018,As at 29 February 2020,Glory Rich International Development Limited,富鴻國際發展有限公司,14-Jan-20,R
4391,2323/2018,As at 29 February 2020,Rabbit Credit Limited,月兔信貸有限公司,11-Feb-20,R
4938,2322/2018,As at 29 February 2020,Prospects Group Limited,,22-Feb-20,R
4921,2321/2018,As at 29 February 2020,Pine International Holdings Limited,松栢國際集團有限公司,28-Nov-19,R
4833,2320/2018,As at 29 February 2020,Wealth Prime Credit Service Limited,富盈信貸有限公司,30-Nov-19,R
4652,2319/2018,As at 29 February 2020,Hong Jian Company Limited,鴻楗有限公司,15-Dec-19,R
4640,2318/2018,As at 29 February 2020,Elephant Service Limited,,29-Nov-19,R
4587,2317/2018,As at 29 February 2020,Yue Xiu Investment Consultants Limited,越秀投資咨詢有限公司,15-Dec-19,R
4328,2316/2018,As at 29 February 2020,CC Credit Services Limited,御富信貸(國際)有限公司,24-Dec-19,R
4322,2314/2018,As at 29 February 2020,Prior Credit Limited,昇悅信貸有限公司,17-Dec-19,R
4320,2313/2018,As at 29 February 2020,Meson Union Finance Limited,民盛友聯金融有限公司,17-Dec-19,R
4307,2311/2018,As at 29 February 2020,Dagoro Credit Limited,大家樂信貸有限公司,01-Dec-19,R
4224,2310/2018,As at 29 February 2020,Churchill Finance Limited,,28-Jan-20,R
3975,2309/2018,As at 29 February 2020,Oi Wah Property Credit Limited,靄華物業信貸有限公司,20-Jan-20,R
3954,2308/2018,As at 29 February 2020,Cater Finance Company Limited,加泰財務有限公司,23-Dec-19,R
3459,2307/2018,As at 29 February 2020,Happy Credit Limited,喜喜信用有限公司,27-Nov-19,R
3428,2306/2018,As at 29 February 2020,Fulitone Wealth Management Limited,富利通理財有限公司,21-Feb-20,R
3422,2305/2018,As at 29 February 2020,Bongyan Finance Limited,邦仁財務有限公司,22-Jan-20,R
3296,2304/2018,As at 29 February 2020,TF Advances Limited,,31-Jan-20,R
3281,2303/2018,As at 29 February 2020,Fullrich Financial Services (Asia) Limited,富高財務(亞洲)有限公司,05-Jan-20,R
3174,2302/2018,As at 29 February 2020,Surmount Credit Service Limited,凌龍財務信貸有限公司,22-Feb-20,R
3164,2301/2018,As at 29 February 2020,First One Finance Limited,第一財務有限公司,25-Jan-20,R
3115,2300/2018,As at 29 February 2020,Speed Finance Express Limited,光速信貸快遞有限公司,12-Jan-20,R
3046,2299/2018,As at 29 February 2020,"China Rise Finance Co., Limited",華晉財務有限公司,05-Feb-20,R
2936,2298/2018,As at 29 February 2020,Edward Wong Credit Limited,安泰授信有限公司,09-Jan-20,R
2935,2297/2018,As at 29 February 2020,Man Wah Finance Limited,文華財務有限公司,28-Dec-19,R
2781,2296/2018,As at 29 February 2020,Silver City Asia Finance Limited,銀都亞洲財務有限公司,17-Feb-20,R
1511,2295/2018,As at 29 February 2020,BMW Financial Services Hong Kong Limited,,20-Jan-20,R
1159,2294/2018,As at 29 February 2020,Fuyo General Lease (HK) Limited,芙蓉總合利市(香港)有限公司,13-Feb-20,R
254,2293/2018,As at 29 February 2020,Winton Financial Limited,運通泰財務有限公司,29-Dec-19,R
4997,2292/2018,As at 29 February 2020,Teamway Finance Limited,天幕財務有限公司,20-Feb-20,R
4943,2290/2018,As at 29 February 2020,Concentric Global Limited,同心環球有限公司,14-Dec-19,R
4708,2289/2018,As at 29 February 2020,Friendly Go Finance Limited,友達財務有限公司,21-Feb-20,R
4593,2288/2018,As at 29 February 2020,Hao Tian International Finance Company Limited,昊天國際財務有限公司,20-Dec-19,R
4351,2287/2018,As at 29 February 2020,Tanrich Finance Limited,敦沛財務有限公司,05-Jan-20,R
4348,2286/2018,As at 29 February 2020,Aplus Solutions Limited,,29-Dec-19,R
4344,2285/2018,As at 29 February 2020,Yu Rong Capital Limited,譽榮財資有限公司,31-Dec-19,R
4325,2284/2018,As at 29 February 2020,Top Vast Finance Limited,天偉財務有限公司,24-Dec-19,R
4313,2282/2018,As at 29 February 2020,Blessing Wise Limited,達海有限公司,10-Dec-19,R
4289,2280/2018,As at 29 February 2020,Hong Kong Finance Credit Limited,香港融資信貸有限公司,19-Nov-19,R
3969,2279/2018,As at 29 February 2020,Sun Power Finance Limited,新力財務有限公司,08-Jan-20,R
3696,2278/2018,As at 29 February 2020,Wings Finance Limited,永時信貸有限公司,06-Feb-20,R
3694,2277/2018,As at 29 February 2020,FSE Finance Limited,豐盛創建財務有限公司,28-Jan-20,R
3495,2276/2018,As at 29 February 2020,Pinestone Capital Group Limited,鼎石資本集團有限公司,14-Feb-20,R
3492,2275/2018,As at 29 February 2020,Alright Finance Services Limited,安諾財務有限公司,05-Feb-20,R
3477,2274/2018,As at 29 February 2020,Rifa Credit Limited,日發信貸有限公司,08-Jan-20,R
3181,2273/2018,As at 29 February 2020,JC International Finance Limited,明諾國際財務有限公司,30-Dec-19,R
